Id,Name,Description,Username,Unit Price(in $),Stock Quantity,Stock Alert Threshold,Last Stock Entry Date,Last Stock Exit Date
12345,Toyota Corrola,This is a good car,oussama_el_arif,7000,150,10,20/12/2022,26/12/2024
1,Raibi Jamila,This is za best juice,youness_sbai,0.20,500,100,29/12/2024,29/12/2024
53242,Dell Inspiron439,This laptop has touch screen,amine_bounya,900,400,20,9/10/2023,1/12/2024
12456,Iphone 16,This is the latest iphone,youness_sbai,1500,1000,90,19/10/2024,12/12/2024
41,Vista,Vista impermiable khawa dyali,ikram_khardali,15.00,300,70,30/12/2024,30/12/2024
21268,Trident,Trident with mint flavor,ikram_khardali,0.05,500,50,30/12/2024,30/12/2024
31282,Tager,Small tager,oprog,0.15,200,30,30/12/2024,30/12/2024
11721,Blue Spectrum,This is a good earphone,youness_sbai,0.25,100,10,30/12/2024,30/12/2024
